{
  "name":  "Tim De Keukelaere",
  "handle":  "tim-de-keukelaere",
  "avatar":  "https://images.mvp.microsoft.com/0b9407f9-3c9a-e411-93f2-9cb65495d3c4",
  "mvp":  {
        "status":  "active",
        "category":  "Security"
      },
  "title":  "Endpoint Management and Security specialist.",
  "bio":  "Tim is a freelance consultant with two decades of experience in the field, mainly in enterprise environments. He has a broad technical knowledge and is focused on endpoint management and endpoint security.",
  "links":  {
        "twitter":  "Tim_DK",
        "linkedin":  "timdekeukelaere"
      },
  "feeds":  [
      ]
}
