{
  "name": "Sune Thomsen",
  "handle": "sune-thomsen",
  "title": "Consultant",
  "bio": "Modern Workplace consultant focused on Windows and device management.",
  "links": {
    "linkedin": "sunethomsendk",
    "twitter": "SuneThomsenDK"
  },
  "feeds": [
    {
      "type": "blog",
      "url": "https://blog.mindcore.dk/author/sune-thomsen/feed/",
      "author": "Sune Thomsen"
    }
  ]
}