{
  "name":  "Shuji Noguchi",
  "handle":  "shuji-noguchi",
  "avatar":  "https://images.mvp.microsoft.com/5f21ae4a-405c-461b-8736-4ac9fd89e4f0?638686519786774957",
  "mvp":  {
        "status":  "active",
        "category":  "Security"
      },
  "title":  "Enterprise Mobility Expert",
  "bio":  "As an expert in enterprise mobility, I pride myself on my experience and knowledge in the fields of Microsoft Entra ID, Intune, Autopilot, thin clients, remote desktop, VDI, VPN, WiFi, GSA, certificates, and Active Directory. From mobile device management to network security, I provide solutions ...",
  "links":  {
        "twitter":  "nogushu",
        "linkedin":  "shuji-noguchi-36704844"
      },
  "feeds":  [
        {
          "type":  "blog",
          "url":  "https://www.docswell.com/feed/latest"
        },
        {
          "type":  "blog",
          "url":  "https://qiita.com/carol0226/feed"
        }
      ]
}
