{
  "name":  "Panu Saukko",
  "handle":  "panu-saukko",
  "avatar":  "https://images.mvp.microsoft.com/8182d172-3c9a-e411-93f2-9cb65495d3c4",
  "mvp":  {
        "status":  "active",
        "category":  "Security"
      },
  "title":  "Endpoint management is what I do",
  "bio":  "I work for ProTrainIT Oy with many hats: trainer, consultant \u0026 CEO. \r\n\r\nI have been a MCT since 1995. Currently I mostly consult and train about Microsoft\u0027s endpoint management products (Intune, ConfigMgr, Windows etc). \r\n\r\nDuring my trainer years I have created a few thousand pages of training m...",
  "links":  {
        "twitter":  "panusaukko",
        "linkedin":  "panusaukko"
      },
  "feeds":  [
        {
          "type":  "blog",
          "url":  "https://bsky.app/profile/did:plc:l66dz5s5jhfwuutcf2e5acbr/rss"
        }
      ]
}
