{
  "name":  "Shehan Perera",
  "handle":  "shehan-perera",
  "avatar":  "https://images.mvp.microsoft.com/fafff9c8-ff3e-ed11-bba3-000d3a197333?638798945828877261",
  "mvp":  {
        "status":  "active",
        "category":  "Security"
      },
  "title":  "Blogger, Endpoint and Identity Architect, Nerd",
  "bio":  "I’m Shehan, and I’m from Adelaide, Australia.\n\nI’m an Endpoint and Identity Architect at Bastion Technology Services, a 24/7 Microsoft 365 and Cloud enthusiast, a serial blogger, a Marvel and Star Wars Fanatic, a Metal Head, and a full-time dad.",
  "links":  {
        "linkedin":  "shehanperera85",
        "twitter":  "Shehanperera85",
        "website":  "https://emsroute.com",
        "github":  "shehanperera85"
      },
  "feeds":  [
        {
          "type":  "github-user",
          "username":  "shehanperera85"
        },
        {
          "type":  "youtube",
          "channel":  "@emsroute"
        },
        {
          "type":  "youtube",
          "channel":  "@OOBCasts"
        },
        {
          "type":  "blog",
          "url":  "https://emsroute.com/feed"
        }
      ]
}
