{
  "name": "Nicklas Ahlberg",
  "handle": "nicklas-ahlberg",
  "avatar": "https://images.mvp.microsoft.com/ac3241e1-b667-ec11-8943-0022482d7705",
  "mvp": {
    "status": "active",
    "category": "Windows and Devices"
  },
  "title": "Consultant",
  "bio": "Microsoft MVP - Intune",
  "links": {
    "website": "https://rockenroll.tech",
    "bluesky": "nicklasahlberg.bsky.social",
    "github": "NicklasAhlberg",
    "linkedin": "nicklasahlberg",
    "twitter": "AhlbergNicklas"
  },
  "feeds": [
    {
      "type": "github-user",
      "username": "NicklasAhlberg"
    }
  ]
}