{
  "name":  "Bluesky Social",
  "handle":  "bsky",
  "title":  "Community Publication",
  "bio":  "",
  "links":  {
        "website":  "https://bsky.app/profile/daalmans.com"
      },
  "feeds":  [
        {
          "type":  "blog",
          "url":  "https://bsky.app/profile/did:plc:4k5d7ytzf77y45b77imzuw3v/rss"
        }
      ]
}
