{
  "name": "Brian Mason",
  "handle": "brian-mason",
  "title": "IT Professional",
  "bio": "ConfigMgr and endpoint management community contributor and TCSMUG blogger.",
  "links": {
    "website": "https://tcsmug.org/blogs/brian-mason"
  },
  "feeds": [
    {
      "type": "blog",
      "url": "https://tcsmug.org/blogs/brian-mason?format=feed\u0026type=rss"
    }
  ]
}