{
  "name":  "Petri Paavola",
  "handle":  "petri-paavola",
  "avatar":  "https://images.mvp.microsoft.com/cdb970c0-3c9a-e411-93f2-9cb65495d3c4",
  "mvp":  {
        "status":  "active",
        "category":  "Security"
      },
  "title":  "Developer",
  "bio":  "A Cloud, Intune and Windows Master with MVP and Powershell Skills",
  "links":  {
        "website":  "https://Intune.ninja",
        "bluesky":  "intune.ninja",
        "facebook":  "groups/wpninjasfi",
        "github":  "petripaavola",
        "linkedin":  "petri-paavola",
        "twitter":  "petripaavola",
        "youtube":  "@WorkplaceNinjaUserGroupFinland"
      },
  "feeds":  [
        {
          "type":  "youtube",
          "channel":  "@WorkplaceNinjaUserGroupFinland"
        },
        {
          "type":  "github-user",
          "username":  "petripaavola"
        },
        {
          "type":  "blog",
          "url":  "https://Intune.ninja/feed"
        },
        {
          "type":  "blog",
          "url":  "https://bsky.app/profile/did:plc:j3z4xc35blc4y6kcic45wuyd/rss"
        },
        {
          "type":  "blog",
          "url":  "https://wpninjas.fi/feed.xml"
        }
      ]
}
